<?xml version="1.0" encoding="UTF-8"?>
<xs:schema xmlns:xs="http://www.w3.org/2001/XMLSchema">
    <xs:element name="pedido">
        <xs:complexType>
            <xs:sequence>
                <xs:element name="empleadoresponsable"/>
                <xs:element name="enviar_a">
                    <xs:complexType>
                        <xs:sequence>
                            <xs:element name="nomcliente" type="xs:string"/>
                            <xs:element name="direccion" type="xs:string"/>
                            <xs:element name="ciudad" type="xs:string"/>
                            <xs:element name="pais" type="xs:string"/>
                        </xs:sequence>
                    </xs:complexType>
                </xs:element>
                <xs:element name="producto" minOccurs="1" maxOccurs="unbounded">
                    <xs:complexType>
                        <xs:sequence>
                            <xs:element name="titulo" type="xs:string"/>
                            <xs:element name="nota" type="xs:string" minOccurs="0"/>
                            <xs:element name="cantidad" type="xs:int"/>
                            <xs:element name="precio" type="xs:float"/>
                        </xs:sequence>
                    </xs:complexType>
                </xs:element>
            </xs:sequence>
            <xs:attribute name="numpedido" type="xs:string" use="required"/>
        </xs:complexType>
    </xs:element>
</xs:schema>