<?xml version="1.0" encoding="UTF-8"?>
<pedido numpedido="889923" xmlns:xsi="http://www.w3.org/2001/XMLSchema-instance" xsi:noNamespaceSchemaLocation="actividad3.xsd">
    <empleadoresponsable>Pepe López</empleadoresponsable>
    <enviar_a>
        <nomcliente>Ana García</nomcliente>
        <direccion>C/ Mayor, 5</direccion>
        <ciudad>46470 Catarroja</ciudad>
        <pais>España</pais>
    </enviar_a>
    <producto>
        <titulo>El Quijote</titulo>
        <nota>Edición especial</nota>
        <cantidad>1</cantidad>
        <precio>15.90</precio>
    </producto>
    <producto>
        <titulo>Misión Imposible</titulo>
        <cantidad>1</cantidad>
        <precio>9.90</precio>
    </producto>
</pedido>